{
  "schema": "romeo/task-envelope@0.1.0",
  "unit_id": "feat-20260831-repeat-brake-82zv",
  "role": "implementer",
  "spec_ref": {
    "path": "docs/work/feat-20260831-repeat-brake-82zv/spec.md",
    "sha256": "c5838c63f136038ebdc167fd9f2be98e3b08626dd8ecc9eddc1d86e2ca34e6b2"
  },
  "base_sha": "6f4ef05ed56ec2b83b5559bb8c743dbff159cf9b",
  "allowed_paths": [
    "docs/work/feat-20260831-repeat-brake-82zv/",
    "romeo/run_unit.py",
    "romeo/envelope.py",
    "romeo/close.py",
    "core/schemas/task-envelope.json",
    "core/templates/tech-spec.md",
    "adapters/orca/RUNBOOK.md",
    "docs/planning/open-questions.md",
    "tests/test_run_unit.py"
  ],
  "guards": [],
  "required_checks": [
    {
      "id": "check-1",
      "command": "python3 -m unittest tests.test_run_unit.RepeatGate.test_review_does_not_reset_counter"
    },
    {
      "id": "check-2",
      "command": "python3 -m unittest tests.test_run_unit.RepeatGate.test_pass_resets_counter"
    },
    {
      "id": "check-3",
      "command": "python3 -m unittest tests.test_run_unit.RepeatGate.test_envelope_build_refuses_when_blocked"
    },
    {
      "id": "check-4",
      "command": "python3 -m unittest tests.test_run_unit.RepeatGate.test_envelope_build_allows_when_not_blocked"
    },
    {
      "id": "check-5",
      "command": "! grep -qF 'expect:' core/templates/tech-spec.md"
    },
    {
      "id": "check-6",
      "command": "grep -qF '종료 코드 자체가 조건' core/templates/tech-spec.md"
    },
    {
      "id": "check-7",
      "command": "! grep -q '\"expect\"' core/schemas/task-envelope.json && ! grep -q 'expect' romeo/envelope.py romeo/close.py"
    },
    {
      "id": "check-8",
      "command": "grep -qF '우회 가능 — v1 이후' docs/planning/open-questions.md"
    },
    {
      "id": "check-9",
      "command": "grep -qF '중단 게이트' adapters/orca/RUNBOOK.md"
    },
    {
      "id": "check-10",
      "command": "python3 -m unittest discover -s tests"
    },
    {
      "id": "check-11",
      "command": "bin/romeo validate"
    },
    {
      "id": "check-12",
      "command": "bin/romeo compile --check"
    },
    {
      "id": "check-13",
      "command": "bin/romeo doctor"
    },
    {
      "id": "check-14",
      "command": "bin/romeo fixtures parity --report"
    }
  ],
  "output_schema": "core/schemas/result-envelope.json",
  "workspace": "worktree"
}
