{
  "schema": "romeo/task-envelope@0.1.0",
  "unit_id": "feat-20260829-license-field-46an",
  "role": "reviewer",
  "spec_ref": {
    "path": "docs/work/feat-20260829-license-field-46an/spec.md",
    "sha256": "bc29d233130fedadbfe48ae01821f5fcd1cae5fa5ebb1832232ded7ea64079c7"
  },
  "base_sha": "7f8ecd7449a5953d6b1d6b3b16d1113b4bae4f98",
  "allowed_paths": [],
  "guards": [],
  "required_checks": [
    {
      "id": "check-1",
      "command": "bash scripts/validate-repo-archive.sh archive/obra-superpowers",
      "expect": "exit 0"
    },
    {
      "id": "check-2",
      "command": "test \"$(grep -l '^- License: ' archive/*/_source.md | wc -l | tr -d ' ')\" = \"$(ls -d archive/*/ | wc -l | tr -d ' ')\"",
      "expect": "exit 0"
    },
    {
      "id": "check-3",
      "command": "t=$(mktemp -d) && test -n \"$t\" && cp -R archive/obra-superpowers/. \"$t\" && grep -v '^- License: ' \"$t/_source.md\" > \"$t/_source.tmp\" && mv \"$t/_source.tmp\" \"$t/_source.md\" && bash scripts/validate-repo-archive.sh \"$t\" 2>&1 | grep -q 'does not contain a License field'",
      "expect": "exit 0 (License 줄을 지운 사본에서 검증기가 **그 사유로** FAIL 해야 통과. `test -n` 이 임시 디렉터리 변수가 비었을 때 작업 트리에 쓰는 것을 막는다)"
    },
    {
      "id": "check-4",
      "command": "python3 scripts/generate-archive-index.py --check",
      "expect": "exit 0"
    },
    {
      "id": "check-5",
      "command": "python3 -m unittest discover -s tests",
      "expect": "exit 0"
    },
    {
      "id": "check-6",
      "command": "python3 scripts/check-archive-licenses.py",
      "expect": "exit 0 (18개 값이 계획 §1.3 표의 「`_source.md` 에 적는 값」 열과 전부 일치해야 통과 — AC-1 을 대조하는 유일한 검사다)"
    }
  ],
  "output_schema": "core/schemas/result-envelope.json",
  "workspace": "worktree"
}
