{
  "schema": "romeo/task-envelope@0.1.0",
  "unit_id": "feat-20260901-coordinator-procedure-gaps-y8fu",
  "role": "reviewer",
  "spec_ref": {
    "path": "docs/work/feat-20260901-coordinator-procedure-gaps-y8fu/spec.md",
    "sha256": "be28c0dea9949ad815bef4e3ccb0183e9124f6f3ece0fdfa21882ff840aa9f65"
  },
  "base_sha": "82a8191ddf11c6e90263fab6a1356ebc74529c32",
  "allowed_paths": [],
  "guards": [],
  "required_checks": [
    {
      "id": "check-1",
      "command": "awk '/^### 3\\.1 /,/^### 3\\.2 /' adapters/orca/RUNBOOK.md | grep -q 'attempts\\.yaml'"
    },
    {
      "id": "check-2",
      "command": "awk '/^### 3\\.1 /,/^### 3\\.2 /' adapters/orca/RUNBOOK.md | grep -qE 'git (show|diff|ls-tree)[^|]*attempts\\.yaml'"
    },
    {
      "id": "check-3",
      "command": "python3 -m unittest tests.test_runbook_procedure -v"
    },
    {
      "id": "check-4",
      "command": "awk '/^## 3\\. 실행 순서/,/^## 4\\./' adapters/orca/RUNBOOK.md | grep -qE '^### 3\\.[0-9.]+ .*재작업'"
    },
    {
      "id": "check-5",
      "command": "python3 -c \"import re,sys; t=open('adapters/orca/RUNBOOK.md').read(); m=re.search(r'^### 3\\.[0-9.]+ [^\\n]*재작업[^\\n]*\\n(.*?)(?=^#{2,3} )', t, re.S|re.M); b=m.group(1) if m else ''; sys.exit(0 if '_stamp_ids' in b and 'run-create' in b else 1)\""
    },
    {
      "id": "check-6",
      "command": "awk '/^## 3\\. 실행 순서/,/^## 4\\./' adapters/orca/RUNBOOK.md | grep -q 'run-use --id'"
    },
    {
      "id": "check-7",
      "command": "awk '/^## 3\\. 실행 순서/,/^## 4\\./' adapters/orca/RUNBOOK.md | grep -q 'run-current'"
    },
    {
      "id": "check-8",
      "command": "python3 -c \"import yaml,sys; k=(yaml.safe_load(open('.harness/observations.yaml')) or {}).get('coordinator_run_rebinding') or {}; need=('a_switch_back','b_read_after_switch','c_rejection_shape'); sys.exit(0 if all(isinstance(k.get(n),dict) and any(str(k[n].get(f,'')).strip() for f in ('result','exit_code')) for n in need) else 1)\""
    },
    {
      "id": "check-15",
      "command": "python3 -c \"import glob,yaml,sys; hits=[c for f in glob.glob('docs/work/feat-20260901-coordinator-procedure-gaps-y8fu/evidence/*.yaml') for c in (yaml.safe_load(open(f)) or {}).get('commands',[]) if str(c.get('id','')).startswith('run-rebinding-probe')]; sys.exit(0 if hits and all(str(c.get('stdout_tail','')).strip() and c.get('log_sha256') for c in hits) else 1)\""
    },
    {
      "id": "check-9",
      "command": "grep -q 'feat-20260901-coordinator-procedure-gaps-y8fu' docs/planning/progress.md"
    },
    {
      "id": "check-10",
      "command": "! grep -q '다음 정비 후보다' docs/planning/progress.md"
    },
    {
      "id": "check-11",
      "command": "python3 -m unittest discover -s tests"
    },
    {
      "id": "check-12",
      "command": "bin/romeo validate"
    },
    {
      "id": "check-13",
      "command": "bin/romeo doctor --strict --scope repository"
    },
    {
      "id": "check-14",
      "command": "bin/romeo compile --check"
    }
  ],
  "output_schema": "core/schemas/result-envelope.json",
  "workspace": "worktree"
}
