{
  "schema": "romeo/task-envelope@0.1.0",
  "unit_id": "feat-20260829-license-field-46an",
  "role": "reviewer",
  "spec_ref": {
    "path": "docs/work/feat-20260829-license-field-46an/spec.md",
    "sha256": "67d6b7de91247873d1e59de299f6118ec7fb67ece8a10b320688abee2a474b0e"
  },
  "base_sha": "6e5290012dd8f088d3ede4b78f4c9e7c31877609",
  "allowed_paths": [],
  "guards": [],
  "required_checks": [
    {
      "id": "check-1",
      "command": "bash scripts/validate-repo-archive.sh archive/obra-superpowers",
      "expect": "exit 0"
    },
    {
      "id": "check-2",
      "command": "test \"$(grep -l '^- License: ' archive/*/_source.md | wc -l | tr -d ' ')\" = \"$(ls -d archive/*/ | wc -l | tr -d ' ')\"",
      "expect": "exit 0"
    },
    {
      "id": "check-3",
      "command": "t=$(mktemp -d) && cp -R archive/obra-superpowers/. \"$t\" && grep -v '^- License: ' \"$t/_source.md\" > \"$t/_source.tmp\" && mv \"$t/_source.tmp\" \"$t/_source.md\" && ! bash scripts/validate-repo-archive.sh \"$t\"",
      "expect": "exit 0 (License 줄이 없으면 검증기가 FAIL 해야 통과)"
    },
    {
      "id": "check-4",
      "command": "python3 scripts/generate-archive-index.py --check",
      "expect": "exit 0"
    },
    {
      "id": "check-5",
      "command": "python3 -m unittest discover -s tests",
      "expect": "exit 0"
    }
  ],
  "output_schema": "core/schemas/result-envelope.json",
  "workspace": "worktree"
}
